{
  "plan_version": "0.1",
  "seed": 42,
  "schema_ref": {
    "schema_version": "0.2",
    "engine": "postgres"
  },
  "targets": [
    {
      "schema": "crm",
      "table": "usuarios",
      "rows": 50
    },
    {
      "schema": "crm",
      "table": "contatos",
      "rows": 200
    },
    {
      "schema": "crm",
      "table": "oportunidades",
      "rows": 120
    }
  ],
  "rules": [
    {
      "type": "column_generator",
      "schema": "crm",
      "table": "usuarios",
      "column": "id",
      "generator": "uuid"
    },
    {
      "type": "column_generator",
      "schema": "crm",
      "table": "usuarios",
      "column": "email",
      "generator": "email"
    },
    {
      "type": "column_generator",
      "schema": "crm",
      "table": "contatos",
      "column": "email",
      "generator": "email"
    },
    {
      "type": "column_generator",
      "schema": "crm",
      "table": "contatos",
      "column": "data_nascimento",
      "generator": "date_range",
      "params": {
        "min": "1970-01-01",
        "max": "2005-12-31"
      }
    },
    {
      "type": "column_generator",
      "schema": "crm",
      "table": "oportunidades",
      "column": "valor_estimado",
      "generator": "int_range",
      "params": {
        "min": 100,
        "max": 250000
      }
    },
    {
      "type": "constraint_policy",
      "schema": "crm",
      "table": "contatos",
      "constraint": "check",
      "mode": "enforce"
    },
    {
      "type": "foreign_key_strategy",
      "schema": "crm",
      "table": "contatos",
      "mode": "respect"
    }
  ],
  "rules_unsupported": [
    {
      "description": "Gerador de telefone regional",
      "reason": "generator nao implementado",
      "reference": {
        "schema": "crm",
        "table": "usuarios",
        "column": "telefone"
      }
    }
  ]
}
